<?xml version="1.0" encoding="utf-8"?>
<doc
	xmlns="http://javacoredoc.fugerit.org"
	xmlns:xsi="http://www.w3.org/2001/XMLSchema-instance"
    xsi:schemaLocation="http://javacoredoc.fugerit.org http://www.fugerit.org/data/java/doc/xsd/doc-1-0.xsd" > 

  <!-- 
  	Sample Apache FreeMarker template for Fugerit Doc.
  	Note : this example has no intention of being a guid to FreeMarker
  			(In case check FreeMarker documentation https://freemarker.apache.org/docs/index.html)
   -->

  <meta>
  
  	<!-- Margin for document : left;right;top;bottom -->
  	<info name="margins">10;10;10;30</info>  
  
	<info name="excel-table-id">excel-table=print</info>
	<info name="excel-width-multiplier">450</info>
	
	<!-- you need to escape free marker expression for currentPage --> 
	<footer-ext numbered="true" align="right">
		<para>${r"${currentPage}"}</para>
	</footer-ext>
	 
  </meta>
 
  <body>
  
  		<phrase>Test template page apache free marker</phrase>
  
  		<image url="cl://test/img_test_green.png" scaling="100"/>
  
  		<image url="cl://test/img_test_red.png" scaling="50"/>
  
  		<image url="png" base64="${testBase64Img}" scaling="25"/>	
  
    	<table columns="3" colwidths="30;30;40"  width="100" id="excel-table" padding="2">
    		<row>
    			<cell align="center" border-color="#ee0000" border-width="1"><para style="bold">Name</para></cell>
    			<cell align="center"><para style="bold">Surname</para></cell>
    			<cell align="center"><para style="bold">Title</para></cell>
    		</row>
			<#list userList as user>
				<#include "/include/test_01_row.xml">
			</#list>   		
    	</table>
  </body>
  
</doc>